"High Performance Python","2021/01/19,2021/01/20,2021/01/21","https://cal.lib.virginia.edu/event/7403863","Katherine Holcomb"
"Introduction to Shiny","2021-02-04","https://cal.lib.virginia.edu/event/7405869","Christina Gancayco"
"Parallel Matlab I","2021-02-05","https://cal.lib.virginia.edu/event/7405744","Ed Hall"
"Customizing Shiny Apps","2021-02-11","https://cal.lib.virginia.edu/event/7405875","Christina Gancayco"
"Parallel Matlab II","2021-02-12","https://cal.lib.virginia.edu/event/7405745","Ed Hall"
"Optimizing R Code","2021-02-12","https://cal.hsl.virginia.edu/event/7374945","Jacalyn Huband"
"Building Containers for Rivanna","2021-02-18","https://cal.lib.virginia.edu/event/7404771","Ruoshi Sun"
"Optimizing Matlab Code","2021-02-19","https://cal.lib.virginia.edu/event/7405853","Ed Hall"
"Minimal Containers","2021-02-25","https://cal.lib.virginia.edu/event/7405203","Ruoshi Sun"
"Biopython","2021-02-25","https://cal.hsl.virginia.edu/event/7375022","Karsten Siller"
"Using Bioinformatics tools on Rivanna","2021-03-16","https://cal.hsl.virginia.edu/event/7374868","Gladys Andino"
"Parallelizing R","2021-03-12","https://cal.lib.virginia.edu/event/7403936","Jacalyn Huband"
"R with MPI","2021-04-09","https://cal.lib.virginia.edu/event/7404438","Jacalyn Huband"
"Introduction to Python","2021-06-02,2021-06-03","https://cal.lib.virginia.edu/event/7754751","Katherine Holcomb, Erich Purpur, Karsten Siller"
"Introduction to Fortran","2021/06/09","https://cal.lib.virginia.edu/event/7751972","Katherine Holcomb, Ruoshi Sun"
"Introduction to C++","2021/06/09","https://cal.lib.virginia.edu/event/7754536","Katherine Holcomb, Ruoshi Sun"
"Introduction to MPI Part 1","2021/06/16","https://cal.lib.virginia.edu/event/7754562","Katherine Holcomb, Ruoshi Sun"
"Introduction to MPI Part 2","2021/06/16","https://cal.lib.virginia.edu/event/7754575","Katherine Holcomb, Ruoshi Sun"
"Introduction to OpenMP and GPU programming","2021/06/11","https://cal.lib.virginia.edu/event/7754623","Katherine Holcomb, Ruoshi Sun"
"Machine Learning with Python","2021/06/23","https://cal.hsl.virginia.edu/event/7750392","Jacalyn Huband, Will Rosenow"
"Introduction to Shiny","2021/06/30","https://cal.hsl.virginia.edu/event/7750410","Christina Gancayco"
"Using Rivanna from the Command Line","2021/09/22","https://cal.lib.virginia.edu/event/8167461","Gladys Andino"
"Sentiment Analysis with Python","2021/09/30","https://cal.lib.virginia.edu/event/8228133","Jacalyn Huband"
"Parallel Processing with Matlab","2021/10/07","https://cal.lib.virginia.edu/event/8225990","Ed Hall"
"Introduction to Multicore Processing with R","2021/10/07","https://cal.lib.virginia.edu/event/8225891","Jacalyn Huband"
"Using Bioinformatics tools on Rivanna","2021/10/12","https://cal.hsl.virginia.edu/event/8216606","Gladys Andino"
"Automation of Image Processing with Fiji/ImageJ","2021/10/14","https://cal.hsl.virginia.edu/event/8216562","Karsten Siller"
"Introduction to Shiny","2021/10/20","https://cal.hsl.virginia.edu/event/8219502","Christina Gancayco"
"Scientific Image Processing with Matlab","2021/10/21","https://cal.lib.virginia.edu/event/8363724","Ed Hall"
"Building Containers for Rivanna","2021/10/25","https://cal.hsl.virginia.edu/event/8356781","Ruoshi Sun"
"RNA-Seq Analysis, Part I & II","2021/10/27,2021/11/03","https://cal.hsl.virginia.edu/event/8171152","Gladys Andino, Pankaj Kumar"
"Customizing Shiny Apps","2021/10/27","https://cal.hsl.virginia.edu/event/8223838","Christina Gancayco"
"Scientific Image Processing with Python","2021/11/04","https://cal.lib.virginia.edu/event/8167460","Karsten Siller"
"Scientific Computing with Julia on Rivanna","2021/11/04","https://cal.lib.virginia.edu/event/8363728","Ed Hall"
"Accelerate Python with RAPIDS","2021/11/08","https://cal.lib.virginia.edu/event/8363730","Ruoshi Sun"
"Ensembl Browser Workshop","2022/01/10,2022/01/11","https://cal.hsl.virginia.edu/event/8546745","Michal Szpak and Aleena Mushtaq, European Bioinformatics Institute"
"Ensembl REST API Workshop","2022/01/12,2022/01/13","https://cal.hsl.virginia.edu/event/8546795","Michal Szpak and Aleena Mushtaq, European Bioinformatics Institute"
"Parallel/GPU Computing with MATLAB","2022/02/03","https://cal.lib.virginia.edu/event/8689571","Ed Hall"
"Scientific Image Processing with Python","2022/02/09","https://cal.lib.virginia.edu/event/8689620","Karsten Siller"
"Converting Jupyter Notebooks to run as a Batch Job","2022/02/17","https://cal.lib.virginia.edu/event/8689641","Jacalyn Huband"
"Single Cell RNA Analysis","2022/02/21","https://cal.hsl.virginia.edu/event/8685013","Will Rosenow"
"Optimization Techniques for MATLAB","2022/02/24","https://cal.lib.virginia.edu/event/8689696","Ed Hall"
"Building Containers for Rivanna","2022/02/28","https://cal.hsl.virginia.edu/event/8685020","Ruoshi Sun"
"Using Spark on Rivanna","2022/03/14","https://cal.lib.virginia.edu/event/8689703","Ruoshi Sun"
"Using Rivanna from the Command Line","2022/03/16","https://cal.hsl.virginia.edu/event/8685021","Gladys Andino"
"Introduction to Python for Scientists","2022/06/07","https://cal.lib.virginia.edu/event/9109355","Katherine Holcomb"
"High Performance Python","2022/06/09","https://cal.lib.virginia.edu/event/9109427","Katherine Holcomb"
"Machine Learning for Python","2022/06/09","https://cal.lib.virginia.edu/event/9107028","Jacalyn Huband"
"Deep Learning MATLAB","2022/06/10","https://cal.lib.virginia.edu/event/9107301","Ed Hall"
"Rivanna from the Command Line","2022/09/14","https://cal.lib.virginia.edu/event/9538476","Ahmad Sheikhzada, Gladys Andino"
"Using Containers on Rivanna","2022/09/15","https://cal.hsl.virginia.edu/event/9532749","Ruoshi Sun, Gladys Andino"
"Introduction to Multicore Processing with R","2022/09/22","https://cal.lib.virginia.edu/event/9534575","Jacalyn Huband"
"Introduction to Shiny Apps","2022/09/26","https://cal.lib.virginia.edu/event/9534777","Christina Gancayco"
"Data Transfer -- How to use Globus","2022/09/29","https://cal.hsl.virginia.edu/event/9532704","Ed Hall, Christina Gancayco"
"Building Containers for Rivanna","2022/09/30","https://cal.hsl.virginia.edu/event/9532778","Ruoshi Sun"
"Customizing Shiny Apps","2022/10/10","https://cal.lib.virginia.edu/event/9534969","Christina Gancayco"
"Parallel Matlab on Rivanna","2022/10/13","https://cal.lib.virginia.edu/event/9534376","Ed Hall"
"GPU-Enabled Applications on Rivanna","2022/10/20","https://cal.lib.virginia.edu/event/9534448","Ruoshi Sun, Ed Hall, Jacalyn Huband, Christina Gancayco"
"Scientific Image Processing with Python","2022/10/27","https://cal.hsl.virginia.edu/event/9544203","Karsten Siller"
"Using Rivanna from the Command Line","2023/02/01","https://cal.lib.virginia.edu/event/10090539","Ahmad Sheikhzada, Gladys Andino"
"Data Transfer with Globus","2023/02/02","https://cal.lib.virginia.edu/event/10090631","Ed Hall, Christina Gancayco"
"Using Containers on Rivanna","2023/02/06","https://cal.lib.virginia.edu/event/10090580","Ruoshi Sun"
"R Environment Management","2023/02/09","https://cal.lib.virginia.edu/event/10090465","Jacalyn Huband, Gladys Andino"
"Compiling and running C/C++/Fortran on Rivanna","2023/03/01","https://cal.lib.virginia.edu/event/10090665","Katherine Holcomb"
"Making R Run Faster on Rivanna","2023/03/16","https://cal.lib.virginia.edu/event/10090557","Jacalyn Huband"